{
  "schemaVersion": "0.1-draft",
  "status": "HOST_ONLY_NOT_RUNTIME",
  "notice": "Conceptual authoring examples only. No Unity asset or frozen Udon/API contract is produced. Null scale/value fields are intentionally unresolved.",
  "definitions": [
    {
      "definitionId": "picnic.food.apple",
      "candidateRefs": ["PIC-04"],
      "status": "PREVIEW_CANDIDATE",
      "sourceRefs": [
        {
          "packageId": "KENNEY-FOOD-KIT-2.0",
          "memberPath": "Models/GLB format/apple.glb",
          "evidenceType": "VERIFIED_PREVIEW",
          "sourceMemberSha256": "2a80ab65d5bc2cb4f2bca1e8176cbb591849a288596d4b2e76e411338761a526",
          "previewDerivativeSha256": "0ac01021950c0ae51fafb234cf3d43dacabf99e94c773bdd91dc40e5b222f5fd",
          "licenseEvidenceStatus": "PACKAGE_LEVEL_ONLY_PER_FILE_REVIEW_PENDING"
        }
      ],
      "renderPolicy": {"localVisualLodRef": null, "remoteProxyVariant": null, "licenseEvidenceStatus": "PACKAGE_LEVEL_ONLY_PER_FILE_REVIEW_PENDING"},
      "renderObservation": {
        "evidenceType": "VERIFIED_PREVIEW",
        "meshCount": 1,
        "materialSlotCount": 1,
        "triangleCount": 136,
        "sourceUnitsStatus": "OPEN",
        "sourceAxisStatus": "OPEN",
        "pivotStatus": "OPEN",
        "previewNormalizationGameplayScale": false,
        "note": "Blender importer observation only; preview normalization is for layout and does not set world size or item count."
      },
      "gameplayValues": {
        "interactionRole": "UNDECIDED",
        "semanticTier": "m",
        "gainVolumeUnits": null,
        "pickupDiameterWorldM": null,
        "collisionRadiusWorldM": null,
        "scaleStatus": "OPEN",
        "surfaceClass": null,
        "surfaceClassStatus": "OPEN",
        "canWakePhysics": null,
        "canWakePhysicsStatus": "OPEN"
      },
      "geometryLayers": {
        "renderMesh": {"sourceRefIndices": [0], "status": "PREVIEWED"},
        "gameplayColliderProxy": {"status": "NOT_DESIGNED", "shape": "UNKNOWN", "dimensionsWorldM": null, "affectsSharedPvpCollision": false, "note": "Do not derive from render bounds."},
        "shapeSupportProxy": {"status": "NOT_DESIGNED", "shape": "UNKNOWN", "pointUnitStatus": "OPEN", "supportPointsLocal": [], "affectsSharedPvpCollision": false, "note": "Separate support/extreme representation; not a gameplay collision contract."}
      },
      "compositionPolicy": "ONE_DEFINITION_ONE_INSTANCE_IF_APPROVED",
      "supportPolicy": "NO_SUPPORT_PARENT",
      "note": "Preview and package evidence do not grant per-file rights approval or gameplay acceptance."
    },
    {
      "definitionId": "picnic.tableware.cup",
      "candidateRefs": ["PIC-19"],
      "status": "METADATA_CANDIDATE",
      "sourceRefs": [
        {
          "packageId": "KENNEY-FOOD-KIT-2.0",
          "memberPath": "Models/GLB format/cup.glb",
          "evidenceType": "ZIP_METADATA_ONLY",
          "sourceMemberSha256": null,
          "previewDerivativeSha256": null,
          "licenseEvidenceStatus": "PACKAGE_LEVEL_ONLY_PER_FILE_REVIEW_PENDING"
        }
      ],
      "renderPolicy": {"localVisualLodRef": null, "remoteProxyVariant": null, "licenseEvidenceStatus": "PACKAGE_LEVEL_ONLY_PER_FILE_REVIEW_PENDING"},
      "renderObservation": {
        "evidenceType": "ZIP_METADATA_ONLY",
        "meshCount": null,
        "materialSlotCount": null,
        "triangleCount": null,
        "sourceUnitsStatus": "OPEN",
        "sourceAxisStatus": "OPEN",
        "pivotStatus": "OPEN",
        "previewNormalizationGameplayScale": false,
        "note": "Inventory filename candidate only; not extracted or visually checked in P21."
      },
      "gameplayValues": {
        "interactionRole": "UNDECIDED",
        "semanticTier": "m",
        "gainVolumeUnits": null,
        "pickupDiameterWorldM": null,
        "collisionRadiusWorldM": null,
        "scaleStatus": "OPEN",
        "surfaceClass": null,
        "surfaceClassStatus": "OPEN",
        "canWakePhysics": null,
        "canWakePhysicsStatus": "OPEN"
      },
      "geometryLayers": {
        "renderMesh": {"sourceRefIndices": [0], "status": "CANDIDATE"},
        "gameplayColliderProxy": {"status": "NOT_DESIGNED", "shape": "UNKNOWN", "dimensionsWorldM": null, "affectsSharedPvpCollision": false, "note": "Separate future gameplay collider review."},
        "shapeSupportProxy": {"status": "NOT_DESIGNED", "shape": "UNKNOWN", "pointUnitStatus": "OPEN", "supportPointsLocal": [], "affectsSharedPvpCollision": false, "note": "Separate future shape/support review."}
      },
      "compositionPolicy": "UNDECIDED",
      "supportPolicy": "UNDECIDED",
      "note": "Definition identity follows the cup concept, not the source filename."
    },
    {
      "definitionId": "picnic.tableware.cup_saucer_candidate",
      "candidateRefs": ["PIC-19"],
      "status": "METADATA_CANDIDATE",
      "sourceRefs": [
        {
          "packageId": "KENNEY-FOOD-KIT-2.0",
          "memberPath": "Models/GLB format/cup-saucer.glb",
          "evidenceType": "ZIP_METADATA_ONLY",
          "sourceMemberSha256": null,
          "previewDerivativeSha256": null,
          "licenseEvidenceStatus": "PACKAGE_LEVEL_ONLY_PER_FILE_REVIEW_PENDING"
        }
      ],
      "renderPolicy": {"localVisualLodRef": null, "remoteProxyVariant": null, "licenseEvidenceStatus": "PACKAGE_LEVEL_ONLY_PER_FILE_REVIEW_PENDING"},
      "renderObservation": {
        "evidenceType": "ZIP_METADATA_ONLY",
        "meshCount": null,
        "materialSlotCount": null,
        "triangleCount": null,
        "sourceUnitsStatus": "OPEN",
        "sourceAxisStatus": "OPEN",
        "pivotStatus": "OPEN",
        "previewNormalizationGameplayScale": false,
        "note": "Filename suggests a combined candidate only; geometry and cup/saucer boundaries are not visually verified."
      },
      "gameplayValues": {
        "interactionRole": "UNDECIDED",
        "semanticTier": "m",
        "gainVolumeUnits": null,
        "pickupDiameterWorldM": null,
        "collisionRadiusWorldM": null,
        "scaleStatus": "OPEN",
        "surfaceClass": null,
        "surfaceClassStatus": "OPEN",
        "canWakePhysics": null,
        "canWakePhysicsStatus": "OPEN"
      },
      "geometryLayers": {
        "renderMesh": {"sourceRefIndices": [0], "status": "CANDIDATE"},
        "gameplayColliderProxy": {"status": "NOT_DESIGNED", "shape": "UNKNOWN", "dimensionsWorldM": null, "affectsSharedPvpCollision": false, "note": "No proxy is inferred from the asset filename."},
        "shapeSupportProxy": {"status": "NOT_DESIGNED", "shape": "UNKNOWN", "pointUnitStatus": "OPEN", "supportPointsLocal": [], "affectsSharedPvpCollision": false, "note": "No support points have been measured or authored."}
      },
      "compositionPolicy": "UNDECIDED",
      "supportPolicy": "UNDECIDED",
      "note": "If a future review approves an atomic set, it can be one definition/instance regardless of mesh or material-slot count."
    },
    {
      "definitionId": "picnic.tableware.plate",
      "candidateRefs": ["PIC-20"],
      "status": "METADATA_CANDIDATE",
      "sourceRefs": [
        {
          "packageId": "KENNEY-FOOD-KIT-2.0",
          "memberPath": "Models/GLB format/plate.glb",
          "evidenceType": "ZIP_METADATA_ONLY",
          "sourceMemberSha256": null,
          "previewDerivativeSha256": null,
          "licenseEvidenceStatus": "PACKAGE_LEVEL_ONLY_PER_FILE_REVIEW_PENDING"
        }
      ],
      "renderPolicy": {"localVisualLodRef": null, "remoteProxyVariant": null, "licenseEvidenceStatus": "PACKAGE_LEVEL_ONLY_PER_FILE_REVIEW_PENDING"},
      "renderObservation": {
        "evidenceType": "ZIP_METADATA_ONLY",
        "meshCount": null,
        "materialSlotCount": null,
        "triangleCount": null,
        "sourceUnitsStatus": "OPEN",
        "sourceAxisStatus": "OPEN",
        "pivotStatus": "OPEN",
        "previewNormalizationGameplayScale": false,
        "note": "Exact filename candidate from frozen ZIP inventory; visual form remains unknown."
      },
      "gameplayValues": {
        "interactionRole": "UNDECIDED",
        "semanticTier": "m",
        "gainVolumeUnits": null,
        "pickupDiameterWorldM": null,
        "collisionRadiusWorldM": null,
        "scaleStatus": "OPEN",
        "surfaceClass": null,
        "surfaceClassStatus": "OPEN",
        "canWakePhysics": null,
        "canWakePhysicsStatus": "OPEN"
      },
      "geometryLayers": {
        "renderMesh": {"sourceRefIndices": [0], "status": "CANDIDATE"},
        "gameplayColliderProxy": {"status": "NOT_DESIGNED", "shape": "UNKNOWN", "dimensionsWorldM": null, "affectsSharedPvpCollision": false, "note": "Independent of presentation mesh."},
        "shapeSupportProxy": {"status": "NOT_DESIGNED", "shape": "UNKNOWN", "pointUnitStatus": "OPEN", "supportPointsLocal": [], "affectsSharedPvpCollision": false, "note": "Independent of collision proxy."}
      },
      "compositionPolicy": "ONE_DEFINITION_ONE_INSTANCE_IF_APPROVED",
      "supportPolicy": "UNDECIDED",
      "note": "A plate mesh or material slots do not create additional collectible entities."
    },
    {
      "definitionId": "picnic.furniture.side_table",
      "candidateRefs": ["PIC-36"],
      "status": "PLACEHOLDER_ONLY",
      "sourceRefs": [],
      "renderPolicy": {"localVisualLodRef": null, "remoteProxyVariant": null, "licenseEvidenceStatus": "NO_SOURCE_NOT_ASSESSED"},
      "renderObservation": {
        "evidenceType": "NO_SOURCE",
        "meshCount": null,
        "materialSlotCount": null,
        "triangleCount": null,
        "sourceUnitsStatus": "OPEN",
        "sourceAxisStatus": "OPEN",
        "pivotStatus": "OPEN",
        "previewNormalizationGameplayScale": false,
        "note": "Conceptual host-side example only; no source asset is claimed."
      },
      "gameplayValues": {
        "interactionRole": "UNDECIDED",
        "semanticTier": "l",
        "gainVolumeUnits": null,